Resource17;{Resource17, Resource04};{Resource04, Resource02, Resource17, Resource08};{Resource18, Resource04, Resource17, Resource08, Resource02};{Resource15, Resource09, Resource18, Resource04, Resource17, Resource08, Resource02, Resource05};{Resource21, Resource02, Resource05, Resource15, Resource18, Resource04, Resource17, Resource09, Resource08};{Resource14, Resource21, Resource02, Resource05, Resource15, Resource18, Resource04, Resource17, Resource09, Resource08};{Resource14, Resource21, Resource02, Resource05, Resource15, Resource18, Resource04, Resource17, Resource09, Resource08, Resource12};{Resource01, Resource12, Resource21, Resource02, Resource05, Resource17, Resource04, Resource09, Resource19, Resource07, admin1, Resource14, Resource15, Resource18, Resource08, Resource11, Resource10};{Resource01, Resource21, Resource02, Resource05, Resource17, Resource04, Resource09, Resource10, Resource19, Resource07, admin1, Resource14, Resource24, Resource15, Resource18, Resource08, Resource11, Resource12};{Resource01, Resource12, Resource21, Resource06, Resource02, Resource05, Resource17, Resource04, Resource09, Resource19, Resource07, admin1, Resource14, Resource24, Resource15, Resource18, Resource08, Resource11, Resource10};{Resource01, Resource12, Resource26, Resource21, Resource06, Resource34, Resource02, Resource05, Resource13, Resource17, Resource04, Resource09, Resource10, Resource19, Resource07, admin1, Resource14, Resource03, Resource24, Resource15, Resource18, Resource08, Resource11, Resource23, Resource22};{Resource01, Resource26, Resource21, Resource06, Resource34, Resource02, Resource05, Resource13, Resource17, Resource04, Resource09, Resource10, Resource19, Resource07, Resource35, admin1, Resource23, Resource14, Resource03, Resource24, Resource15, admin2, Resource18, Resource08, Resource11, Resource12, Resource22};{Resource01, Resource12, Resource26, Resource21, Resource06, Resource34, Resource02, Resource05, Resource13, Resource32, Resource17, Resource04, Resource09, Resource19, Resource07, Resource35, admin1, Resource23, Resource14, Resource03, Resource24, Resource15, admin2, Resource18, Resource08, Resource11, Resource10, Resource22};{Resource01, Resource26, Resource21, Resource06, admin3, Resource34, Resource02, Resource05, Resource13, Resource32, Resource17, Resource04, Resource09, Resource10, Resource19, Resource38, Resource07, Resource35, admin1, Resource23, Resource14, Resource29, Resource03, Resource24, Resource15, admin2, Resource18, Resource08, Resource11, Resource12, Resource22};{Resource01, Resource27, Resource26, Resource21, Resource06, admin3, Resource34, Resource02, Resource05, Resource13, Resource32, Resource39, Resource17, Resource04, Resource09, Resource10, Resource19, Resource38, Resource07, Resource35, admin1, Resource23, Resource14, Resource29, Resource03, Resource24, Resource15, admin2, Resource18, Resource08, Resource11, Resource12, Resource22};{Resource25, Resource26, Resource34, Resource13, Resource39, Resource17, Resource09, Resource20, Resource19, Resource38, Resource07, Resource35, Resource29, Resource03, Resource18, Resource08, Resource11, Resource10, Resource12, Resource01, Resource27, Resource21, Resource06, Resource02, admin3, Resource05, Resource32, Resource04, admin1, Resource14, Resource24, Resource15, admin2, Resource23, Resource22};{Resource25, Resource26, Resource34, Resource13, Resource43, Resource39, Resource17, Resource09, Resource20, Resource19, Resource38, Resource07, Resource35, Resource29, Resource03, Resource18, Resource08, Resource11, Resource10, Resource12, Resource01, Resource27, Resource21, Resource06, Resource02, admin3, Resource05, Resource32, Resource04, admin1, Resource14, Resource24, Resource15, admin2, Resource23, Resource22};{Resource25, Resource26, Resource34, Resource13, Resource43, Resource39, Resource17, Resource09, Resource20, Resource19, Resource38, Resource07, Resource35, Resource29, Resource03, Resource18, Resource08, Resource11, Resource10, Resource12, Resource01, Resource27, Resource21, Resource06, Resource02, admin3, Resource05, Resource32, Resource04, admin1, Resource14, Resource24, Resource15, admin2, Resource23, Resource16, Resource22};{Resource25, Resource26, Resource34, Resource13, Resource43, Resource39, Resource17, Resource09, Resource20, Resource19, Resource38, Resource07, Resource35, Resource29, Resource03, Resource18, Resource08, Resource11, Resource10, Resource12, Resource01, Resource27, Resource21, Resource06, Resource02, admin3, Resource05, Resource32, Resource04, admin1, Resource14, Resource24, Resource15, admin2, Resource33, Resource23, Resource16, Resource22};{Resource25, Resource26, Resource34, Resource13, Resource43, Resource39, Resource17, Resource09, Resource20, Resource19, Resource38, Resource07, Resource35, Resource29, Resource03, Resource18, Resource08, Resource11, Resource10, Resource12, Resource01, Resource27, Resource21, Resource06, Resource02, admin3, Resource05, Resource32, Resource04, Resource30, admin1, Resource14, Resource24, Resource15, admin2, Resource33, Resource23, Resource16, Resource22};*
Resource18;{Resource18_dummy};{Resource18_dummy};{Resource18, Resource04, Resource17, Resource08, Resource02};{Resource15, Resource09, Resource18, Resource04, Resource17, Resource08, Resource02, Resource05};{Resource21, Resource02, Resource05, Resource15, Resource18, Resource04, Resource17, Resource09, Resource08};{Resource14, Resource21, Resource02, Resource05, Resource15, Resource18, Resource04, Resource17, Resource09, Resource08};{Resource14, Resource21, Resource02, Resource05, Resource15, Resource18, Resource04, Resource17, Resource09, Resource08, Resource12};{Resource01, Resource12, Resource21, Resource02, Resource05, Resource17, Resource04, Resource09, Resource19, Resource07, admin1, Resource14, Resource15, Resource18, Resource08, Resource11, Resource10};{Resource01, Resource21, Resource02, Resource05, Resource17, Resource04, Resource09, Resource10, Resource19, Resource07, admin1, Resource14, Resource24, Resource15, Resource18, Resource08, Resource11, Resource12};{Resource01, Resource12, Resource21, Resource06, Resource02, Resource05, Resource17, Resource04, Resource09, Resource19, Resource07, admin1, Resource14, Resource24, Resource15, Resource18, Resource08, Resource11, Resource10};{Resource01, Resource12, Resource26, Resource21, Resource06, Resource34, Resource02, Resource05, Resource13, Resource17, Resource04, Resource09, Resource10, Resource19, Resource07, admin1, Resource14, Resource03, Resource24, Resource15, Resource18, Resource08, Resource11, Resource23, Resource22};{Resource01, Resource26, Resource21, Resource06, Resource34, Resource02, Resource05, Resource13, Resource17, Resource04, Resource09, Resource10, Resource19, Resource07, Resource35, admin1, Resource23, Resource14, Resource03, Resource24, Resource15, admin2, Resource18, Resource08, Resource11, Resource12, Resource22};{Resource01, Resource12, Resource26, Resource21, Resource06, Resource34, Resource02, Resource05, Resource13, Resource32, Resource17, Resource04, Resource09, Resource19, Resource07, Resource35, admin1, Resource23, Resource14, Resource03, Resource24, Resource15, admin2, Resource18, Resource08, Resource11, Resource10, Resource22};{Resource01, Resource26, Resource21, Resource06, admin3, Resource34, Resource02, Resource05, Resource13, Resource32, Resource17, Resource04, Resource09, Resource10, Resource19, Resource38, Resource07, Resource35, admin1, Resource23, Resource14, Resource29, Resource03, Resource24, Resource15, admin2, Resource18, Resource08, Resource11, Resource12, Resource22};{Resource01, Resource27, Resource26, Resource21, Resource06, admin3, Resource34, Resource02, Resource05, Resource13, Resource32, Resource39, Resource17, Resource04, Resource09, Resource10, Resource19, Resource38, Resource07, Resource35, admin1, Resource23, Resource14, Resource29, Resource03, Resource24, Resource15, admin2, Resource18, Resource08, Resource11, Resource12, Resource22};{Resource25, Resource26, Resource34, Resource13, Resource39, Resource17, Resource09, Resource20, Resource19, Resource38, Resource07, Resource35, Resource29, Resource03, Resource18, Resource08, Resource11, Resource10, Resource12, Resource01, Resource27, Resource21, Resource06, Resource02, admin3, Resource05, Resource32, Resource04, admin1, Resource14, Resource24, Resource15, admin2, Resource23, Resource22};{Resource25, Resource26, Resource34, Resource13, Resource43, Resource39, Resource17, Resource09, Resource20, Resource19, Resource38, Resource07, Resource35, Resource29, Resource03, Resource18, Resource08, Resource11, Resource10, Resource12, Resource01, Resource27, Resource21, Resource06, Resource02, admin3, Resource05, Resource32, Resource04, admin1, Resource14, Resource24, Resource15, admin2, Resource23, Resource22};{Resource25, Resource26, Resource34, Resource13, Resource43, Resource39, Resource17, Resource09, Resource20, Resource19, Resource38, Resource07, Resource35, Resource29, Resource03, Resource18, Resource08, Resource11, Resource10, Resource12, Resource01, Resource27, Resource21, Resource06, Resource02, admin3, Resource05, Resource32, Resource04, admin1, Resource14, Resource24, Resource15, admin2, Resource23, Resource16, Resource22};{Resource25, Resource26, Resource34, Resource13, Resource43, Resource39, Resource17, Resource09, Resource20, Resource19, Resource38, Resource07, Resource35, Resource29, Resource03, Resource18, Resource08, Resource11, Resource10, Resource12, Resource01, Resource27, Resource21, Resource06, Resource02, admin3, Resource05, Resource32, Resource04, admin1, Resource14, Resource24, Resource15, admin2, Resource33, Resource23, Resource16, Resource22};{Resource25, Resource26, Resource34, Resource13, Resource43, Resource39, Resource17, Resource09, Resource20, Resource19, Resource38, Resource07, Resource35, Resource29, Resource03, Resource18, Resource08, Resource11, Resource10, Resource12, Resource01, Resource27, Resource21, Resource06, Resource02, admin3, Resource05, Resource32, Resource04, Resource30, admin1, Resource14, Resource24, Resource15, admin2, Resource33, Resource23, Resource16, Resource22};*
Resource19;{Resource19_dummy};{Resource19_dummy};{Resource19_dummy};{Resource19_dummy};{Resource19_dummy};{admin1, Resource10, Resource19};{admin1, Resource19, Resource01, Resource11, Resource10, Resource07};{Resource01, Resource12, Resource21, Resource02, Resource05, Resource17, Resource04, Resource09, Resource19, Resource07, admin1, Resource14, Resource15, Resource18, Resource08, Resource11, Resource10};{Resource01, Resource21, Resource02, Resource05, Resource17, Resource04, Resource09, Resource10, Resource19, Resource07, admin1, Resource14, Resource24, Resource15, Resource18, Resource08, Resource11, Resource12};{Resource01, Resource12, Resource21, Resource06, Resource02, Resource05, Resource17, Resource04, Resource09, Resource19, Resource07, admin1, Resource14, Resource24, Resource15, Resource18, Resource08, Resource11, Resource10};{Resource01, Resource12, Resource26, Resource21, Resource06, Resource34, Resource02, Resource05, Resource13, Resource17, Resource04, Resource09, Resource10, Resource19, Resource07, admin1, Resource14, Resource03, Resource24, Resource15, Resource18, Resource08, Resource11, Resource23, Resource22};{Resource01, Resource26, Resource21, Resource06, Resource34, Resource02, Resource05, Resource13, Resource17, Resource04, Resource09, Resource10, Resource19, Resource07, Resource35, admin1, Resource23, Resource14, Resource03, Resource24, Resource15, admin2, Resource18, Resource08, Resource11, Resource12, Resource22};{Resource01, Resource12, Resource26, Resource21, Resource06, Resource34, Resource02, Resource05, Resource13, Resource32, Resource17, Resource04, Resource09, Resource19, Resource07, Resource35, admin1, Resource23, Resource14, Resource03, Resource24, Resource15, admin2, Resource18, Resource08, Resource11, Resource10, Resource22};{Resource01, Resource26, Resource21, Resource06, admin3, Resource34, Resource02, Resource05, Resource13, Resource32, Resource17, Resource04, Resource09, Resource10, Resource19, Resource38, Resource07, Resource35, admin1, Resource23, Resource14, Resource29, Resource03, Resource24, Resource15, admin2, Resource18, Resource08, Resource11, Resource12, Resource22};{Resource01, Resource27, Resource26, Resource21, Resource06, admin3, Resource34, Resource02, Resource05, Resource13, Resource32, Resource39, Resource17, Resource04, Resource09, Resource10, Resource19, Resource38, Resource07, Resource35, admin1, Resource23, Resource14, Resource29, Resource03, Resource24, Resource15, admin2, Resource18, Resource08, Resource11, Resource12, Resource22};{Resource25, Resource26, Resource34, Resource13, Resource39, Resource17, Resource09, Resource20, Resource19, Resource38, Resource07, Resource35, Resource29, Resource03, Resource18, Resource08, Resource11, Resource10, Resource12, Resource01, Resource27, Resource21, Resource06, Resource02, admin3, Resource05, Resource32, Resource04, admin1, Resource14, Resource24, Resource15, admin2, Resource23, Resource22};{Resource25, Resource26, Resource34, Resource13, Resource43, Resource39, Resource17, Resource09, Resource20, Resource19, Resource38, Resource07, Resource35, Resource29, Resource03, Resource18, Resource08, Resource11, Resource10, Resource12, Resource01, Resource27, Resource21, Resource06, Resource02, admin3, Resource05, Resource32, Resource04, admin1, Resource14, Resource24, Resource15, admin2, Resource23, Resource22};{Resource25, Resource26, Resource34, Resource13, Resource43, Resource39, Resource17, Resource09, Resource20, Resource19, Resource38, Resource07, Resource35, Resource29, Resource03, Resource18, Resource08, Resource11, Resource10, Resource12, Resource01, Resource27, Resource21, Resource06, Resource02, admin3, Resource05, Resource32, Resource04, admin1, Resource14, Resource24, Resource15, admin2, Resource23, Resource16, Resource22};{Resource25, Resource26, Resource34, Resource13, Resource43, Resource39, Resource17, Resource09, Resource20, Resource19, Resource38, Resource07, Resource35, Resource29, Resource03, Resource18, Resource08, Resource11, Resource10, Resource12, Resource01, Resource27, Resource21, Resource06, Resource02, admin3, Resource05, Resource32, Resource04, admin1, Resource14, Resource24, Resource15, admin2, Resource33, Resource23, Resource16, Resource22};{Resource25, Resource26, Resource34, Resource13, Resource43, Resource39, Resource17, Resource09, Resource20, Resource19, Resource38, Resource07, Resource35, Resource29, Resource03, Resource18, Resource08, Resource11, Resource10, Resource12, Resource01, Resource27, Resource21, Resource06, Resource02, admin3, Resource05, Resource32, Resource04, Resource30, admin1, Resource14, Resource24, Resource15, admin2, Resource33, Resource23, Resource16, Resource22};*
Resource20;{Resource20_dummy};{Resource20_dummy};{Resource20_dummy};{Resource20_dummy};{Resource20_dummy};{Resource20_dummy};{Resource20_dummy};{Resource20_dummy};{Resource20_dummy};{Resource20_dummy};{Resource20_dummy};{Resource20_dummy};{Resource20_dummy};{Resource20_dummy};{Resource20, Resource25};{Resource25, Resource26, Resource34, Resource13, Resource39, Resource17, Resource09, Resource20, Resource19, Resource38, Resource07, Resource35, Resource29, Resource03, Resource18, Resource08, Resource11, Resource10, Resource12, Resource01, Resource27, Resource21, Resource06, Resource02, admin3, Resource05, Resource32, Resource04, admin1, Resource14, Resource24, Resource15, admin2, Resource23, Resource22};{Resource25, Resource26, Resource34, Resource13, Resource43, Resource39, Resource17, Resource09, Resource20, Resource19, Resource38, Resource07, Resource35, Resource29, Resource03, Resource18, Resource08, Resource11, Resource10, Resource12, Resource01, Resource27, Resource21, Resource06, Resource02, admin3, Resource05, Resource32, Resource04, admin1, Resource14, Resource24, Resource15, admin2, Resource23, Resource22};{Resource25, Resource26, Resource34, Resource13, Resource43, Resource39, Resource17, Resource09, Resource20, Resource19, Resource38, Resource07, Resource35, Resource29, Resource03, Resource18, Resource08, Resource11, Resource10, Resource12, Resource01, Resource27, Resource21, Resource06, Resource02, admin3, Resource05, Resource32, Resource04, admin1, Resource14, Resource24, Resource15, admin2, Resource23, Resource16, Resource22};{Resource25, Resource26, Resource34, Resource13, Resource43, Resource39, Resource17, Resource09, Resource20, Resource19, Resource38, Resource07, Resource35, Resource29, Resource03, Resource18, Resource08, Resource11, Resource10, Resource12, Resource01, Resource27, Resource21, Resource06, Resource02, admin3, Resource05, Resource32, Resource04, admin1, Resource14, Resource24, Resource15, admin2, Resource33, Resource23, Resource16, Resource22};{Resource25, Resource26, Resource34, Resource13, Resource43, Resource39, Resource17, Resource09, Resource20, Resource19, Resource38, Resource07, Resource35, Resource29, Resource03, Resource18, Resource08, Resource11, Resource10, Resource12, Resource01, Resource27, Resource21, Resource06, Resource02, admin3, Resource05, Resource32, Resource04, Resource30, admin1, Resource14, Resource24, Resource15, admin2, Resource33, Resource23, Resource16, Resource22};*
Resource21;{Resource21_dummy};{Resource21_dummy};{Resource21_dummy};{Resource21_dummy};{Resource21, Resource02, Resource05, Resource15, Resource18, Resource04, Resource17, Resource09, Resource08};{Resource14, Resource21, Resource02, Resource05, Resource15, Resource18, Resource04, Resource17, Resource09, Resource08};{Resource14, Resource21, Resource02, Resource05, Resource15, Resource18, Resource04, Resource17, Resource09, Resource08, Resource12};{Resource01, Resource12, Resource21, Resource02, Resource05, Resource17, Resource04, Resource09, Resource19, Resource07, admin1, Resource14, Resource15, Resource18, Resource08, Resource11, Resource10};{Resource01, Resource21, Resource02, Resource05, Resource17, Resource04, Resource09, Resource10, Resource19, Resource07, admin1, Resource14, Resource24, Resource15, Resource18, Resource08, Resource11, Resource12};{Resource01, Resource12, Resource21, Resource06, Resource02, Resource05, Resource17, Resource04, Resource09, Resource19, Resource07, admin1, Resource14, Resource24, Resource15, Resource18, Resource08, Resource11, Resource10};{Resource01, Resource12, Resource26, Resource21, Resource06, Resource34, Resource02, Resource05, Resource13, Resource17, Resource04, Resource09, Resource10, Resource19, Resource07, admin1, Resource14, Resource03, Resource24, Resource15, Resource18, Resource08, Resource11, Resource23, Resource22};{Resource01, Resource26, Resource21, Resource06, Resource34, Resource02, Resource05, Resource13, Resource17, Resource04, Resource09, Resource10, Resource19, Resource07, Resource35, admin1, Resource23, Resource14, Resource03, Resource24, Resource15, admin2, Resource18, Resource08, Resource11, Resource12, Resource22};{Resource01, Resource12, Resource26, Resource21, Resource06, Resource34, Resource02, Resource05, Resource13, Resource32, Resource17, Resource04, Resource09, Resource19, Resource07, Resource35, admin1, Resource23, Resource14, Resource03, Resource24, Resource15, admin2, Resource18, Resource08, Resource11, Resource10, Resource22};{Resource01, Resource26, Resource21, Resource06, admin3, Resource34, Resource02, Resource05, Resource13, Resource32, Resource17, Resource04, Resource09, Resource10, Resource19, Resource38, Resource07, Resource35, admin1, Resource23, Resource14, Resource29, Resource03, Resource24, Resource15, admin2, Resource18, Resource08, Resource11, Resource12, Resource22};{Resource01, Resource27, Resource26, Resource21, Resource06, admin3, Resource34, Resource02, Resource05, Resource13, Resource32, Resource39, Resource17, Resource04, Resource09, Resource10, Resource19, Resource38, Resource07, Resource35, admin1, Resource23, Resource14, Resource29, Resource03, Resource24, Resource15, admin2, Resource18, Resource08, Resource11, Resource12, Resource22};{Resource25, Resource26, Resource34, Resource13, Resource39, Resource17, Resource09, Resource20, Resource19, Resource38, Resource07, Resource35, Resource29, Resource03, Resource18, Resource08, Resource11, Resource10, Resource12, Resource01, Resource27, Resource21, Resource06, Resource02, admin3, Resource05, Resource32, Resource04, admin1, Resource14, Resource24, Resource15, admin2, Resource23, Resource22};{Resource25, Resource26, Resource34, Resource13, Resource43, Resource39, Resource17, Resource09, Resource20, Resource19, Resource38, Resource07, Resource35, Resource29, Resource03, Resource18, Resource08, Resource11, Resource10, Resource12, Resource01, Resource27, Resource21, Resource06, Resource02, admin3, Resource05, Resource32, Resource04, admin1, Resource14, Resource24, Resource15, admin2, Resource23, Resource22};{Resource25, Resource26, Resource34, Resource13, Resource43, Resource39, Resource17, Resource09, Resource20, Resource19, Resource38, Resource07, Resource35, Resource29, Resource03, Resource18, Resource08, Resource11, Resource10, Resource12, Resource01, Resource27, Resource21, Resource06, Resource02, admin3, Resource05, Resource32, Resource04, admin1, Resource14, Resource24, Resource15, admin2, Resource23, Resource16, Resource22};{Resource25, Resource26, Resource34, Resource13, Resource43, Resource39, Resource17, Resource09, Resource20, Resource19, Resource38, Resource07, Resource35, Resource29, Resource03, Resource18, Resource08, Resource11, Resource10, Resource12, Resource01, Resource27, Resource21, Resource06, Resource02, admin3, Resource05, Resource32, Resource04, admin1, Resource14, Resource24, Resource15, admin2, Resource33, Resource23, Resource16, Resource22};{Resource25, Resource26, Resource34, Resource13, Resource43, Resource39, Resource17, Resource09, Resource20, Resource19, Resource38, Resource07, Resource35, Resource29, Resource03, Resource18, Resource08, Resource11, Resource10, Resource12, Resource01, Resource27, Resource21, Resource06, Resource02, admin3, Resource05, Resource32, Resource04, Resource30, admin1, Resource14, Resource24, Resource15, admin2, Resource33, Resource23, Resource16, Resource22};*
