Resource22;{Resource22_dummy};{Resource22_dummy};{Resource22_dummy};{Resource22_dummy};{Resource22_dummy};{Resource23, Resource22};{Resource26, Resource23, Resource22};{Resource13, Resource26, Resource23, Resource22};{Resource13, Resource23, Resource26, Resource03, Resource22};{Resource13, Resource26, Resource23, Resource03, Resource34, Resource22};{Resource01, Resource12, Resource26, Resource21, Resource06, Resource34, Resource02, Resource05, Resource13, Resource17, Resource04, Resource09, Resource10, Resource19, Resource07, admin1, Resource14, Resource03, Resource24, Resource15, Resource18, Resource08, Resource11, Resource23, Resource22};{Resource01, Resource26, Resource21, Resource06, Resource34, Resource02, Resource05, Resource13, Resource17, Resource04, Resource09, Resource10, Resource19, Resource07, Resource35, admin1, Resource23, Resource14, Resource03, Resource24, Resource15, admin2, Resource18, Resource08, Resource11, Resource12, Resource22};{Resource01, Resource12, Resource26, Resource21, Resource06, Resource34, Resource02, Resource05, Resource13, Resource32, Resource17, Resource04, Resource09, Resource19, Resource07, Resource35, admin1, Resource23, Resource14, Resource03, Resource24, Resource15, admin2, Resource18, Resource08, Resource11, Resource10, Resource22};{Resource01, Resource26, Resource21, Resource06, admin3, Resource34, Resource02, Resource05, Resource13, Resource32, Resource17, Resource04, Resource09, Resource10, Resource19, Resource38, Resource07, Resource35, admin1, Resource23, Resource14, Resource29, Resource03, Resource24, Resource15, admin2, Resource18, Resource08, Resource11, Resource12, Resource22};{Resource01, Resource27, Resource26, Resource21, Resource06, admin3, Resource34, Resource02, Resource05, Resource13, Resource32, Resource39, Resource17, Resource04, Resource09, Resource10, Resource19, Resource38, Resource07, Resource35, admin1, Resource23, Resource14, Resource29, Resource03, Resource24, Resource15, admin2, Resource18, Resource08, Resource11, Resource12, Resource22};{Resource25, Resource26, Resource34, Resource13, Resource39, Resource17, Resource09, Resource20, Resource19, Resource38, Resource07, Resource35, Resource29, Resource03, Resource18, Resource08, Resource11, Resource10, Resource12, Resource01, Resource27, Resource21, Resource06, Resource02, admin3, Resource05, Resource32, Resource04, admin1, Resource14, Resource24, Resource15, admin2, Resource23, Resource22};{Resource25, Resource26, Resource34, Resource13, Resource43, Resource39, Resource17, Resource09, Resource20, Resource19, Resource38, Resource07, Resource35, Resource29, Resource03, Resource18, Resource08, Resource11, Resource10, Resource12, Resource01, Resource27, Resource21, Resource06, Resource02, admin3, Resource05, Resource32, Resource04, admin1, Resource14, Resource24, Resource15, admin2, Resource23, Resource22};{Resource25, Resource26, Resource34, Resource13, Resource43, Resource39, Resource17, Resource09, Resource20, Resource19, Resource38, Resource07, Resource35, Resource29, Resource03, Resource18, Resource08, Resource11, Resource10, Resource12, Resource01, Resource27, Resource21, Resource06, Resource02, admin3, Resource05, Resource32, Resource04, admin1, Resource14, Resource24, Resource15, admin2, Resource23, Resource16, Resource22};{Resource25, Resource26, Resource34, Resource13, Resource43, Resource39, Resource17, Resource09, Resource20, Resource19, Resource38, Resource07, Resource35, Resource29, Resource03, Resource18, Resource08, Resource11, Resource10, Resource12, Resource01, Resource27, Resource21, Resource06, Resource02, admin3, Resource05, Resource32, Resource04, admin1, Resource14, Resource24, Resource15, admin2, Resource33, Resource23, Resource16, Resource22};{Resource25, Resource26, Resource34, Resource13, Resource43, Resource39, Resource17, Resource09, Resource20, Resource19, Resource38, Resource07, Resource35, Resource29, Resource03, Resource18, Resource08, Resource11, Resource10, Resource12, Resource01, Resource27, Resource21, Resource06, Resource02, admin3, Resource05, Resource32, Resource04, Resource30, admin1, Resource14, Resource24, Resource15, admin2, Resource33, Resource23, Resource16, Resource22};*
Resource23;{Resource23_dummy};{Resource23_dummy};{Resource23_dummy};{Resource23_dummy};{Resource23_dummy};{Resource23, Resource22};{Resource26, Resource23, Resource22};{Resource13, Resource26, Resource23, Resource22};{Resource13, Resource23, Resource26, Resource03, Resource22};{Resource13, Resource26, Resource23, Resource03, Resource34, Resource22};{Resource01, Resource12, Resource26, Resource21, Resource06, Resource34, Resource02, Resource05, Resource13, Resource17, Resource04, Resource09, Resource10, Resource19, Resource07, admin1, Resource14, Resource03, Resource24, Resource15, Resource18, Resource08, Resource11, Resource23, Resource22};{Resource01, Resource26, Resource21, Resource06, Resource34, Resource02, Resource05, Resource13, Resource17, Resource04, Resource09, Resource10, Resource19, Resource07, Resource35, admin1, Resource23, Resource14, Resource03, Resource24, Resource15, admin2, Resource18, Resource08, Resource11, Resource12, Resource22};{Resource01, Resource12, Resource26, Resource21, Resource06, Resource34, Resource02, Resource05, Resource13, Resource32, Resource17, Resource04, Resource09, Resource19, Resource07, Resource35, admin1, Resource23, Resource14, Resource03, Resource24, Resource15, admin2, Resource18, Resource08, Resource11, Resource10, Resource22};{Resource01, Resource26, Resource21, Resource06, admin3, Resource34, Resource02, Resource05, Resource13, Resource32, Resource17, Resource04, Resource09, Resource10, Resource19, Resource38, Resource07, Resource35, admin1, Resource23, Resource14, Resource29, Resource03, Resource24, Resource15, admin2, Resource18, Resource08, Resource11, Resource12, Resource22};{Resource01, Resource27, Resource26, Resource21, Resource06, admin3, Resource34, Resource02, Resource05, Resource13, Resource32, Resource39, Resource17, Resource04, Resource09, Resource10, Resource19, Resource38, Resource07, Resource35, admin1, Resource23, Resource14, Resource29, Resource03, Resource24, Resource15, admin2, Resource18, Resource08, Resource11, Resource12, Resource22};{Resource25, Resource26, Resource34, Resource13, Resource39, Resource17, Resource09, Resource20, Resource19, Resource38, Resource07, Resource35, Resource29, Resource03, Resource18, Resource08, Resource11, Resource10, Resource12, Resource01, Resource27, Resource21, Resource06, Resource02, admin3, Resource05, Resource32, Resource04, admin1, Resource14, Resource24, Resource15, admin2, Resource23, Resource22};{Resource25, Resource26, Resource34, Resource13, Resource43, Resource39, Resource17, Resource09, Resource20, Resource19, Resource38, Resource07, Resource35, Resource29, Resource03, Resource18, Resource08, Resource11, Resource10, Resource12, Resource01, Resource27, Resource21, Resource06, Resource02, admin3, Resource05, Resource32, Resource04, admin1, Resource14, Resource24, Resource15, admin2, Resource23, Resource22};{Resource25, Resource26, Resource34, Resource13, Resource43, Resource39, Resource17, Resource09, Resource20, Resource19, Resource38, Resource07, Resource35, Resource29, Resource03, Resource18, Resource08, Resource11, Resource10, Resource12, Resource01, Resource27, Resource21, Resource06, Resource02, admin3, Resource05, Resource32, Resource04, admin1, Resource14, Resource24, Resource15, admin2, Resource23, Resource16, Resource22};{Resource25, Resource26, Resource34, Resource13, Resource43, Resource39, Resource17, Resource09, Resource20, Resource19, Resource38, Resource07, Resource35, Resource29, Resource03, Resource18, Resource08, Resource11, Resource10, Resource12, Resource01, Resource27, Resource21, Resource06, Resource02, admin3, Resource05, Resource32, Resource04, admin1, Resource14, Resource24, Resource15, admin2, Resource33, Resource23, Resource16, Resource22};{Resource25, Resource26, Resource34, Resource13, Resource43, Resource39, Resource17, Resource09, Resource20, Resource19, Resource38, Resource07, Resource35, Resource29, Resource03, Resource18, Resource08, Resource11, Resource10, Resource12, Resource01, Resource27, Resource21, Resource06, Resource02, admin3, Resource05, Resource32, Resource04, Resource30, admin1, Resource14, Resource24, Resource15, admin2, Resource33, Resource23, Resource16, Resource22};*
Resource24;{Resource24_dummy};{Resource24_dummy};{Resource24_dummy};{Resource24_dummy};{Resource24_dummy};{Resource24_dummy};{Resource24_dummy};{Resource24_dummy};{Resource01, Resource21, Resource02, Resource05, Resource17, Resource04, Resource09, Resource10, Resource19, Resource07, admin1, Resource14, Resource24, Resource15, Resource18, Resource08, Resource11, Resource12};{Resource01, Resource12, Resource21, Resource06, Resource02, Resource05, Resource17, Resource04, Resource09, Resource19, Resource07, admin1, Resource14, Resource24, Resource15, Resource18, Resource08, Resource11, Resource10};{Resource01, Resource12, Resource26, Resource21, Resource06, Resource34, Resource02, Resource05, Resource13, Resource17, Resource04, Resource09, Resource10, Resource19, Resource07, admin1, Resource14, Resource03, Resource24, Resource15, Resource18, Resource08, Resource11, Resource23, Resource22};{Resource01, Resource26, Resource21, Resource06, Resource34, Resource02, Resource05, Resource13, Resource17, Resource04, Resource09, Resource10, Resource19, Resource07, Resource35, admin1, Resource23, Resource14, Resource03, Resource24, Resource15, admin2, Resource18, Resource08, Resource11, Resource12, Resource22};{Resource01, Resource12, Resource26, Resource21, Resource06, Resource34, Resource02, Resource05, Resource13, Resource32, Resource17, Resource04, Resource09, Resource19, Resource07, Resource35, admin1, Resource23, Resource14, Resource03, Resource24, Resource15, admin2, Resource18, Resource08, Resource11, Resource10, Resource22};{Resource01, Resource26, Resource21, Resource06, admin3, Resource34, Resource02, Resource05, Resource13, Resource32, Resource17, Resource04, Resource09, Resource10, Resource19, Resource38, Resource07, Resource35, admin1, Resource23, Resource14, Resource29, Resource03, Resource24, Resource15, admin2, Resource18, Resource08, Resource11, Resource12, Resource22};{Resource01, Resource27, Resource26, Resource21, Resource06, admin3, Resource34, Resource02, Resource05, Resource13, Resource32, Resource39, Resource17, Resource04, Resource09, Resource10, Resource19, Resource38, Resource07, Resource35, admin1, Resource23, Resource14, Resource29, Resource03, Resource24, Resource15, admin2, Resource18, Resource08, Resource11, Resource12, Resource22};{Resource25, Resource26, Resource34, Resource13, Resource39, Resource17, Resource09, Resource20, Resource19, Resource38, Resource07, Resource35, Resource29, Resource03, Resource18, Resource08, Resource11, Resource10, Resource12, Resource01, Resource27, Resource21, Resource06, Resource02, admin3, Resource05, Resource32, Resource04, admin1, Resource14, Resource24, Resource15, admin2, Resource23, Resource22};{Resource25, Resource26, Resource34, Resource13, Resource43, Resource39, Resource17, Resource09, Resource20, Resource19, Resource38, Resource07, Resource35, Resource29, Resource03, Resource18, Resource08, Resource11, Resource10, Resource12, Resource01, Resource27, Resource21, Resource06, Resource02, admin3, Resource05, Resource32, Resource04, admin1, Resource14, Resource24, Resource15, admin2, Resource23, Resource22};{Resource25, Resource26, Resource34, Resource13, Resource43, Resource39, Resource17, Resource09, Resource20, Resource19, Resource38, Resource07, Resource35, Resource29, Resource03, Resource18, Resource08, Resource11, Resource10, Resource12, Resource01, Resource27, Resource21, Resource06, Resource02, admin3, Resource05, Resource32, Resource04, admin1, Resource14, Resource24, Resource15, admin2, Resource23, Resource16, Resource22};{Resource25, Resource26, Resource34, Resource13, Resource43, Resource39, Resource17, Resource09, Resource20, Resource19, Resource38, Resource07, Resource35, Resource29, Resource03, Resource18, Resource08, Resource11, Resource10, Resource12, Resource01, Resource27, Resource21, Resource06, Resource02, admin3, Resource05, Resource32, Resource04, admin1, Resource14, Resource24, Resource15, admin2, Resource33, Resource23, Resource16, Resource22};{Resource25, Resource26, Resource34, Resource13, Resource43, Resource39, Resource17, Resource09, Resource20, Resource19, Resource38, Resource07, Resource35, Resource29, Resource03, Resource18, Resource08, Resource11, Resource10, Resource12, Resource01, Resource27, Resource21, Resource06, Resource02, admin3, Resource05, Resource32, Resource04, Resource30, admin1, Resource14, Resource24, Resource15, admin2, Resource33, Resource23, Resource16, Resource22};*
Resource25;{Resource25_dummy};{Resource25_dummy};{Resource25_dummy};{Resource25_dummy};{Resource25_dummy};{Resource25_dummy};{Resource25_dummy};{Resource25_dummy};{Resource25_dummy};{Resource25_dummy};{Resource25_dummy};{Resource25_dummy};{Resource25_dummy};{Resource25_dummy};{Resource20, Resource25};{Resource25, Resource26, Resource34, Resource13, Resource39, Resource17, Resource09, Resource20, Resource19, Resource38, Resource07, Resource35, Resource29, Resource03, Resource18, Resource08, Resource11, Resource10, Resource12, Resource01, Resource27, Resource21, Resource06, Resource02, admin3, Resource05, Resource32, Resource04, admin1, Resource14, Resource24, Resource15, admin2, Resource23, Resource22};{Resource25, Resource26, Resource34, Resource13, Resource43, Resource39, Resource17, Resource09, Resource20, Resource19, Resource38, Resource07, Resource35, Resource29, Resource03, Resource18, Resource08, Resource11, Resource10, Resource12, Resource01, Resource27, Resource21, Resource06, Resource02, admin3, Resource05, Resource32, Resource04, admin1, Resource14, Resource24, Resource15, admin2, Resource23, Resource22};{Resource25, Resource26, Resource34, Resource13, Resource43, Resource39, Resource17, Resource09, Resource20, Resource19, Resource38, Resource07, Resource35, Resource29, Resource03, Resource18, Resource08, Resource11, Resource10, Resource12, Resource01, Resource27, Resource21, Resource06, Resource02, admin3, Resource05, Resource32, Resource04, admin1, Resource14, Resource24, Resource15, admin2, Resource23, Resource16, Resource22};{Resource25, Resource26, Resource34, Resource13, Resource43, Resource39, Resource17, Resource09, Resource20, Resource19, Resource38, Resource07, Resource35, Resource29, Resource03, Resource18, Resource08, Resource11, Resource10, Resource12, Resource01, Resource27, Resource21, Resource06, Resource02, admin3, Resource05, Resource32, Resource04, admin1, Resource14, Resource24, Resource15, admin2, Resource33, Resource23, Resource16, Resource22};{Resource25, Resource26, Resource34, Resource13, Resource43, Resource39, Resource17, Resource09, Resource20, Resource19, Resource38, Resource07, Resource35, Resource29, Resource03, Resource18, Resource08, Resource11, Resource10, Resource12, Resource01, Resource27, Resource21, Resource06, Resource02, admin3, Resource05, Resource32, Resource04, Resource30, admin1, Resource14, Resource24, Resource15, admin2, Resource33, Resource23, Resource16, Resource22};*
Resource26;{Resource26_dummy};{Resource26_dummy};{Resource26_dummy};{Resource26_dummy};{Resource26_dummy};{Resource26_dummy};{Resource26, Resource23, Resource22};{Resource13, Resource26, Resource23, Resource22};{Resource13, Resource23, Resource26, Resource03, Resource22};{Resource13, Resource26, Resource23, Resource03, Resource34, Resource22};{Resource01, Resource12, Resource26, Resource21, Resource06, Resource34, Resource02, Resource05, Resource13, Resource17, Resource04, Resource09, Resource10, Resource19, Resource07, admin1, Resource14, Resource03, Resource24, Resource15, Resource18, Resource08, Resource11, Resource23, Resource22};{Resource01, Resource26, Resource21, Resource06, Resource34, Resource02, Resource05, Resource13, Resource17, Resource04, Resource09, Resource10, Resource19, Resource07, Resource35, admin1, Resource23, Resource14, Resource03, Resource24, Resource15, admin2, Resource18, Resource08, Resource11, Resource12, Resource22};{Resource01, Resource12, Resource26, Resource21, Resource06, Resource34, Resource02, Resource05, Resource13, Resource32, Resource17, Resource04, Resource09, Resource19, Resource07, Resource35, admin1, Resource23, Resource14, Resource03, Resource24, Resource15, admin2, Resource18, Resource08, Resource11, Resource10, Resource22};{Resource01, Resource26, Resource21, Resource06, admin3, Resource34, Resource02, Resource05, Resource13, Resource32, Resource17, Resource04, Resource09, Resource10, Resource19, Resource38, Resource07, Resource35, admin1, Resource23, Resource14, Resource29, Resource03, Resource24, Resource15, admin2, Resource18, Resource08, Resource11, Resource12, Resource22};{Resource01, Resource27, Resource26, Resource21, Resource06, admin3, Resource34, Resource02, Resource05, Resource13, Resource32, Resource39, Resource17, Resource04, Resource09, Resource10, Resource19, Resource38, Resource07, Resource35, admin1, Resource23, Resource14, Resource29, Resource03, Resource24, Resource15, admin2, Resource18, Resource08, Resource11, Resource12, Resource22};{Resource25, Resource26, Resource34, Resource13, Resource39, Resource17, Resource09, Resource20, Resource19, Resource38, Resource07, Resource35, Resource29, Resource03, Resource18, Resource08, Resource11, Resource10, Resource12, Resource01, Resource27, Resource21, Resource06, Resource02, admin3, Resource05, Resource32, Resource04, admin1, Resource14, Resource24, Resource15, admin2, Resource23, Resource22};{Resource25, Resource26, Resource34, Resource13, Resource43, Resource39, Resource17, Resource09, Resource20, Resource19, Resource38, Resource07, Resource35, Resource29, Resource03, Resource18, Resource08, Resource11, Resource10, Resource12, Resource01, Resource27, Resource21, Resource06, Resource02, admin3, Resource05, Resource32, Resource04, admin1, Resource14, Resource24, Resource15, admin2, Resource23, Resource22};{Resource25, Resource26, Resource34, Resource13, Resource43, Resource39, Resource17, Resource09, Resource20, Resource19, Resource38, Resource07, Resource35, Resource29, Resource03, Resource18, Resource08, Resource11, Resource10, Resource12, Resource01, Resource27, Resource21, Resource06, Resource02, admin3, Resource05, Resource32, Resource04, admin1, Resource14, Resource24, Resource15, admin2, Resource23, Resource16, Resource22};{Resource25, Resource26, Resource34, Resource13, Resource43, Resource39, Resource17, Resource09, Resource20, Resource19, Resource38, Resource07, Resource35, Resource29, Resource03, Resource18, Resource08, Resource11, Resource10, Resource12, Resource01, Resource27, Resource21, Resource06, Resource02, admin3, Resource05, Resource32, Resource04, admin1, Resource14, Resource24, Resource15, admin2, Resource33, Resource23, Resource16, Resource22};{Resource25, Resource26, Resource34, Resource13, Resource43, Resource39, Resource17, Resource09, Resource20, Resource19, Resource38, Resource07, Resource35, Resource29, Resource03, Resource18, Resource08, Resource11, Resource10, Resource12, Resource01, Resource27, Resource21, Resource06, Resource02, admin3, Resource05, Resource32, Resource04, Resource30, admin1, Resource14, Resource24, Resource15, admin2, Resource33, Resource23, Resource16, Resource22};*
Resource27;{Resource27_dummy};{Resource27_dummy};{Resource27_dummy};{Resource27_dummy};{Resource27_dummy};{Resource27_dummy};{Resource27_dummy};{Resource27_dummy};{Resource27_dummy};{Resource27_dummy};{Resource27_dummy};{Resource27_dummy};{Resource27_dummy};{Resource27, Resource39};{Resource01, Resource27, Resource26, Resource21, Resource06, admin3, Resource34, Resource02, Resource05, Resource13, Resource32, Resource39, Resource17, Resource04, Resource09, Resource10, Resource19, Resource38, Resource07, Resource35, admin1, Resource23, Resource14, Resource29, Resource03, Resource24, Resource15, admin2, Resource18, Resource08, Resource11, Resource12, Resource22};{Resource25, Resource26, Resource34, Resource13, Resource39, Resource17, Resource09, Resource20, Resource19, Resource38, Resource07, Resource35, Resource29, Resource03, Resource18, Resource08, Resource11, Resource10, Resource12, Resource01, Resource27, Resource21, Resource06, Resource02, admin3, Resource05, Resource32, Resource04, admin1, Resource14, Resource24, Resource15, admin2, Resource23, Resource22};{Resource25, Resource26, Resource34, Resource13, Resource43, Resource39, Resource17, Resource09, Resource20, Resource19, Resource38, Resource07, Resource35, Resource29, Resource03, Resource18, Resource08, Resource11, Resource10, Resource12, Resource01, Resource27, Resource21, Resource06, Resource02, admin3, Resource05, Resource32, Resource04, admin1, Resource14, Resource24, Resource15, admin2, Resource23, Resource22};{Resource25, Resource26, Resource34, Resource13, Resource43, Resource39, Resource17, Resource09, Resource20, Resource19, Resource38, Resource07, Resource35, Resource29, Resource03, Resource18, Resource08, Resource11, Resource10, Resource12, Resource01, Resource27, Resource21, Resource06, Resource02, admin3, Resource05, Resource32, Resource04, admin1, Resource14, Resource24, Resource15, admin2, Resource23, Resource16, Resource22};{Resource25, Resource26, Resource34, Resource13, Resource43, Resource39, Resource17, Resource09, Resource20, Resource19, Resource38, Resource07, Resource35, Resource29, Resource03, Resource18, Resource08, Resource11, Resource10, Resource12, Resource01, Resource27, Resource21, Resource06, Resource02, admin3, Resource05, Resource32, Resource04, admin1, Resource14, Resource24, Resource15, admin2, Resource33, Resource23, Resource16, Resource22};{Resource25, Resource26, Resource34, Resource13, Resource43, Resource39, Resource17, Resource09, Resource20, Resource19, Resource38, Resource07, Resource35, Resource29, Resource03, Resource18, Resource08, Resource11, Resource10, Resource12, Resource01, Resource27, Resource21, Resource06, Resource02, admin3, Resource05, Resource32, Resource04, Resource30, admin1, Resource14, Resource24, Resource15, admin2, Resource33, Resource23, Resource16, Resource22};*
Resource28;{Resource28_dummy};{Resource28_dummy};{Resource28_dummy};{Resource28_dummy};{Resource28_dummy};{Resource28_dummy};{Resource28_dummy};{Resource28_dummy};{Resource28_dummy};{Resource28_dummy};{Resource28_dummy};{Resource28_dummy};{Resource28_dummy};{Resource28_dummy};{Resource28_dummy};{Resource28_dummy};{Resource28_dummy};{Resource28_dummy};{Resource28, Resource31};{Resource28, Resource36, Resource31};*
Resource29;{Resource29_dummy};{Resource29_dummy};{Resource29_dummy};{Resource29_dummy};{Resource29_dummy};{Resource29_dummy};{Resource29_dummy};{Resource29_dummy};{Resource29_dummy};{Resource29_dummy};{Resource29_dummy};{Resource29_dummy};{Resource29, admin3, Resource38};{Resource01, Resource26, Resource21, Resource06, admin3, Resource34, Resource02, Resource05, Resource13, Resource32, Resource17, Resource04, Resource09, Resource10, Resource19, Resource38, Resource07, Resource35, admin1, Resource23, Resource14, Resource29, Resource03, Resource24, Resource15, admin2, Resource18, Resource08, Resource11, Resource12, Resource22};{Resource01, Resource27, Resource26, Resource21, Resource06, admin3, Resource34, Resource02, Resource05, Resource13, Resource32, Resource39, Resource17, Resource04, Resource09, Resource10, Resource19, Resource38, Resource07, Resource35, admin1, Resource23, Resource14, Resource29, Resource03, Resource24, Resource15, admin2, Resource18, Resource08, Resource11, Resource12, Resource22};{Resource25, Resource26, Resource34, Resource13, Resource39, Resource17, Resource09, Resource20, Resource19, Resource38, Resource07, Resource35, Resource29, Resource03, Resource18, Resource08, Resource11, Resource10, Resource12, Resource01, Resource27, Resource21, Resource06, Resource02, admin3, Resource05, Resource32, Resource04, admin1, Resource14, Resource24, Resource15, admin2, Resource23, Resource22};{Resource25, Resource26, Resource34, Resource13, Resource43, Resource39, Resource17, Resource09, Resource20, Resource19, Resource38, Resource07, Resource35, Resource29, Resource03, Resource18, Resource08, Resource11, Resource10, Resource12, Resource01, Resource27, Resource21, Resource06, Resource02, admin3, Resource05, Resource32, Resource04, admin1, Resource14, Resource24, Resource15, admin2, Resource23, Resource22};{Resource25, Resource26, Resource34, Resource13, Resource43, Resource39, Resource17, Resource09, Resource20, Resource19, Resource38, Resource07, Resource35, Resource29, Resource03, Resource18, Resource08, Resource11, Resource10, Resource12, Resource01, Resource27, Resource21, Resource06, Resource02, admin3, Resource05, Resource32, Resource04, admin1, Resource14, Resource24, Resource15, admin2, Resource23, Resource16, Resource22};{Resource25, Resource26, Resource34, Resource13, Resource43, Resource39, Resource17, Resource09, Resource20, Resource19, Resource38, Resource07, Resource35, Resource29, Resource03, Resource18, Resource08, Resource11, Resource10, Resource12, Resource01, Resource27, Resource21, Resource06, Resource02, admin3, Resource05, Resource32, Resource04, admin1, Resource14, Resource24, Resource15, admin2, Resource33, Resource23, Resource16, Resource22};{Resource25, Resource26, Resource34, Resource13, Resource43, Resource39, Resource17, Resource09, Resource20, Resource19, Resource38, Resource07, Resource35, Resource29, Resource03, Resource18, Resource08, Resource11, Resource10, Resource12, Resource01, Resource27, Resource21, Resource06, Resource02, admin3, Resource05, Resource32, Resource04, Resource30, admin1, Resource14, Resource24, Resource15, admin2, Resource33, Resource23, Resource16, Resource22};*
